{
  "$schema": "http://json-schema.org/draft-07/schema#",
  "$id": "https://shipit.platform/schemas/artifact_reference.schema.json",
  "title": "ArtifactReference",
  "description": "Reference to an artifact produced for a work item (design revision, QA evidence, build artifact, decision). The artifact itself is stored by an opaque provider (uri).",
  "type": "object",
  "additionalProperties": false,
  "required": ["artifactId", "artifactType", "uri", "createdAt"],
  "properties": {
    "artifactId": {
      "type": "string",
      "format": "uuid",
      "description": "Unique identifier for this artifact reference"
    },
    "artifactType": {
      "type": "string",
      "enum": [
        "design_contract",
        "design_revision",
        "code_diff",
        "qa_contract",
        "qa_evidence",
        "build_artifact",
        "deployment_record",
        "human_decision",
        "migration",
        "other"
      ],
      "description": "Kind of artifact this reference points to"
    },
    "uri": {
      "type": "string",
      "minLength": 1,
      "description": "Provider-specific location of the artifact"
    },
    "provider": {
      "type": "string",
      "description": "Optional provider identifier (e.g., ci, artifact-registry)"
    },
    "contentHash": {
      "type": "string",
      "description": "Content hash of the artifact for integrity verification"
    },
    "description": {
      "type": "string",
      "description": "Human-readable description"
    },
    "createdAt": {
      "type": "string",
      "format": "date-time",
      "description": "ISO 8601 timestamp when the reference was recorded"
    }
  }
}